{
  "format_version": "0.1",
  "map": {
    "id": "ola:m:71a7897f-806f-40fa-a88d-051a92562907",
    "slug": "mathematics-macro-atlas",
    "title": "Mathematics Macro Atlas",
    "description": "A breadth-first candidate graph of major mathematical regions and second-level territories, independent of grades, courses, curricula, projects, or learning order.",
    "domain": "mathematics",
    "version": "0.1.0-alpha",
    "status": "candidate",
    "license": "CC-BY-4.0",
    "language": "en",
    "last_updated": "2026-07-21"
  },
  "sources": [
    {
      "id": "ola:s:10f4f235-1c15-4959-a64b-25d0f766996f",
      "revision": 1,
      "title": "Breadth-first mathematics atlas synthesis",
      "source_type": "contributor-analysis",
      "citation": "Wilson, Josiah, and OpenAI Codex. Breadth-first mathematics atlas synthesis. 2026-07-21.",
      "accessed_at": "2026-07-21",
      "notes": "Original candidate decomposition developed under the Open Learning Atlas map constitution."
    },
    {
      "id": "ola:s:9694700b-a8aa-43a8-ae5b-eff223f0097a",
      "revision": 1,
      "title": "Mathematics Subject Classification 2020",
      "source_type": "other",
      "citation": "Mathematical Reviews and zbMATH. Mathematics Subject Classification 2020 (MSC2020). 2020.",
      "url": "https://msc2020.org/",
      "accessed_at": "2026-07-21",
      "notes": "Used only as a coverage audit across pure and applied mathematical literature. MSC labels and hierarchy were not imported; MSC is a literature taxonomy, not a learning or dependency graph."
    }
  ],
  "nodes": [
    {
      "id": "ola:n:fac3bb6f-c693-4b54-b215-5436ecb27f67",
      "revision": 1,
      "kind": "composite",
      "subtype": "atlas-root",
      "assessable": false,
      "slug": "mathematics",
      "label": "Mathematics",
      "definition": "The connected terrain of mathematical objects, structures, representations, practices, methods, and application interfaces described by this candidate atlas.",
      "domains": [
        "mathematics"
      ],
      "status": "candidate",
      "confidence": "medium",
      "source_ids": [
        "ola:s:10f4f235-1c15-4959-a64b-25d0f766996f",
        "ola:s:9694700b-a8aa-43a8-ae5b-eff223f0097a"
      ],
      "review_notes": "Root of the breadth-first candidate atlas; it is a navigational container rather than a claim of final completeness."
    },
    {
      "id": "ola:n:cc007a9a-f88d-4418-b51e-e9c507b6887b",
      "revision": 1,
      "kind": "composite",
      "subtype": "atlas-region",
      "assessable": false,
      "slug": "mathematical-practice-reasoning",
      "label": "Mathematical Practice and Reasoning",
      "definition": "Cross-cutting ways of formulating, representing, investigating, justifying, checking, and communicating mathematics.",
      "domains": [
        "mathematics"
      ],
      "status": "candidate",
      "confidence": "medium",
      "source_ids": [
        "ola:s:10f4f235-1c15-4959-a64b-25d0f766996f",
        "ola:s:9694700b-a8aa-43a8-ae5b-eff223f0097a"
      ],
      "review_notes": "Candidate atlas node. Its placement is navigational and makes no claim about grade, course, difficulty, or instructional order."
    },
    {
      "id": "ola:n:6c2dd104-9a4a-467a-833c-4273fc551359",
      "revision": 1,
      "kind": "composite",
      "subtype": "atlas-region",
      "assessable": false,
      "slug": "quantity-number-systems",
      "label": "Quantity and Number Systems",
      "definition": "Structures and representations used to count, compare, order, and operate on quantities and numbers.",
      "domains": [
        "mathematics"
      ],
      "status": "candidate",
      "confidence": "medium",
      "source_ids": [
        "ola:s:10f4f235-1c15-4959-a64b-25d0f766996f",
        "ola:s:9694700b-a8aa-43a8-ae5b-eff223f0097a"
      ],
      "review_notes": "Candidate atlas node. Its placement is navigational and makes no claim about grade, course, difficulty, or instructional order."
    },
    {
      "id": "ola:n:5b57eeee-e162-430c-ba9d-90ef2c57a6a9",
      "revision": 1,
      "kind": "composite",
      "subtype": "atlas-region",
      "assessable": false,
      "slug": "algebraic-structure-symbolic-relations",
      "label": "Algebraic Structure and Symbolic Relations",
      "definition": "Symbolic relations, operations, and abstract structures through which mathematical regularity is expressed and transformed.",
      "domains": [
        "mathematics"
      ],
      "status": "candidate",
      "confidence": "medium",
      "source_ids": [
        "ola:s:10f4f235-1c15-4959-a64b-25d0f766996f",
        "ola:s:9694700b-a8aa-43a8-ae5b-eff223f0097a"
      ],
      "review_notes": "Candidate atlas node. Its placement is navigational and makes no claim about grade, course, difficulty, or instructional order."
    },
    {
      "id": "ola:n:65a97823-0cd0-4058-889f-1da87e07fcee",
      "revision": 1,
      "kind": "composite",
      "subtype": "atlas-region",
      "assessable": false,
      "slug": "functions-variation-analysis",
      "label": "Functions, Variation, and Analysis",
      "definition": "Dependence, variation, limiting behavior, and analytic structures for describing change and infinite processes.",
      "domains": [
        "mathematics"
      ],
      "status": "candidate",
      "confidence": "medium",
      "source_ids": [
        "ola:s:10f4f235-1c15-4959-a64b-25d0f766996f",
        "ola:s:9694700b-a8aa-43a8-ae5b-eff223f0097a"
      ],
      "review_notes": "Candidate atlas node. Its placement is navigational and makes no claim about grade, course, difficulty, or instructional order."
    },
    {
      "id": "ola:n:e9980cba-ccca-4454-a5ad-4698c5ee58d9",
      "revision": 1,
      "kind": "composite",
      "subtype": "atlas-region",
      "assessable": false,
      "slug": "space-shape-transformation",
      "label": "Space, Shape, and Transformation",
      "definition": "Geometric and topological structures used to describe form, position, invariance, dimension, and spatial change.",
      "domains": [
        "mathematics"
      ],
      "status": "candidate",
      "confidence": "medium",
      "source_ids": [
        "ola:s:10f4f235-1c15-4959-a64b-25d0f766996f",
        "ola:s:9694700b-a8aa-43a8-ae5b-eff223f0097a"
      ],
      "review_notes": "Candidate atlas node. Its placement is navigational and makes no claim about grade, course, difficulty, or instructional order."
    },
    {
      "id": "ola:n:5961ab3d-647d-40d1-9045-ba7f82d9765f",
      "revision": 1,
      "kind": "composite",
      "subtype": "atlas-region",
      "assessable": false,
      "slug": "measurement-dimensional-reasoning",
      "label": "Measurement and Dimensional Reasoning",
      "definition": "The assignment, comparison, composition, and interpretation of quantities through attributes, units, scales, and dimensions.",
      "domains": [
        "mathematics"
      ],
      "status": "candidate",
      "confidence": "medium",
      "source_ids": [
        "ola:s:10f4f235-1c15-4959-a64b-25d0f766996f",
        "ola:s:9694700b-a8aa-43a8-ae5b-eff223f0097a"
      ],
      "review_notes": "Candidate atlas node. Its placement is navigational and makes no claim about grade, course, difficulty, or instructional order."
    },
    {
      "id": "ola:n:686ca659-1a7c-4056-8713-94df74419852",
      "revision": 1,
      "kind": "composite",
      "subtype": "atlas-region",
      "assessable": false,
      "slug": "data-statistics-inference",
      "label": "Data, Statistics, and Inference",
      "definition": "Methods for generating, representing, modeling, and drawing qualified conclusions from variable data.",
      "domains": [
        "mathematics"
      ],
      "status": "candidate",
      "confidence": "medium",
      "source_ids": [
        "ola:s:10f4f235-1c15-4959-a64b-25d0f766996f",
        "ola:s:9694700b-a8aa-43a8-ae5b-eff223f0097a"
      ],
      "review_notes": "Candidate atlas node. Its placement is navigational and makes no claim about grade, course, difficulty, or instructional order."
    },
    {
      "id": "ola:n:bd1591ab-0dd9-45bb-9d85-5a28e5c0c96f",
      "revision": 1,
      "kind": "composite",
      "subtype": "atlas-region",
      "assessable": false,
      "slug": "probability-stochastic-structure",
      "label": "Probability and Stochastic Structure",
      "definition": "Mathematical structures for uncertainty, random variation, dependence, stochastic evolution, and risk.",
      "domains": [
        "mathematics"
      ],
      "status": "candidate",
      "confidence": "medium",
      "source_ids": [
        "ola:s:10f4f235-1c15-4959-a64b-25d0f766996f",
        "ola:s:9694700b-a8aa-43a8-ae5b-eff223f0097a"
      ],
      "review_notes": "Candidate atlas node. Its placement is navigational and makes no claim about grade, course, difficulty, or instructional order."
    },
    {
      "id": "ola:n:616a8a42-2b47-4b8e-8531-62dec9495a12",
      "revision": 1,
      "kind": "composite",
      "subtype": "atlas-region",
      "assessable": false,
      "slug": "discrete-structures",
      "label": "Discrete Structures",
      "definition": "Finite, countable, relational, and algorithmic structures whose behavior is organized through discrete change.",
      "domains": [
        "mathematics"
      ],
      "status": "candidate",
      "confidence": "medium",
      "source_ids": [
        "ola:s:10f4f235-1c15-4959-a64b-25d0f766996f",
        "ola:s:9694700b-a8aa-43a8-ae5b-eff223f0097a"
      ],
      "review_notes": "Candidate atlas node. Its placement is navigational and makes no claim about grade, course, difficulty, or instructional order."
    },
    {
      "id": "ola:n:59080c02-cb1a-4256-a09a-29e6acde9da9",
      "revision": 1,
      "kind": "composite",
      "subtype": "atlas-region",
      "assessable": false,
      "slug": "linear-multilinear-structure",
      "label": "Linear and Multilinear Structure",